吉川元農相の事務所 家宅捜索,25日午前、札幌市北区の吉川貴盛元農水相の地元事務所に東京地検が家宅捜索に入りました。　吉川元農水相は、去年９月までの大臣在任中、広島県の鶏卵生産会社「アキタフーズ」の元代表から、大臣室などで合わせて現金500万円を違法に受領した疑いが持たれています。吉川元農水相は現在、心臓の疾患で入院中で、手術も受けるとして、22日、衆議院議員を辞職していますが、病院内での東京地検特捜部の任意の聴取に対し、現金の受領を認めたとことが関係者への取材でわかりました。「アキタフーズ」側などに対し、特定の便宜を図ったことについては否定しているものとみられます。一方「アキタフーズ」の元代表は特捜部の任意の聴取に対し「業界のためだった」として、現金提供を認めている模様で、特捜部は収賄にあたる可能性があるとみて経緯などを調べています。　吉川元農水相は、衆議院議員として当選６回、北海道内選出の国会議員では、菅総理との関係が最も近い１人でした。農水相として、念願の初入閣を果たしたのは、おととしの第４次安倍改造内閣。国会議員の秘書から始まり、1979年、28歳で道議会議員に初当選。道議会では、今も更新されていない最年少での当選でした。道議を３期つとめた後、1996年には総選挙に出馬。北海道２区では落選しましたが、比例代表で復活当選します。座右の銘は「意志あれば道あり」。当時、国政に「デビュー」した自民党の同期には、菅義偉・総理大臣も。「永田町の階段」を駆け上がっていた菅氏は、いわば「兄貴分」です。菅氏が関わったＴＰＰや農協改革などで、吉川氏は忠誠を尽くしました。また、自民党の実力者・二階幹事長に近い議員としても存在感を発揮。全国から、予算や政策に関して要望が次々と寄せられました。さらに、去年の北海道知事選挙では、自民党道連の会長として「異論」を封じる形で、当時の鈴木直道・夕張市長の擁立を主導。官房長官だった菅総理とともに、鈴木知事誕生の「後ろ盾」となっていました。
年末年始は大雪か 東京氷点下,非常に強い寒気襲来に伴い、年末年始は全国的に気温が低くなります。年明けは東京や名古屋、大阪など都市部でも氷点下の冷え込みで、昼間も5℃前後までしか上がらない予想です。札幌でも真冬日が続き、朝は－10℃以下まで下がる見込みで、各地で厳しい寒さが予想されています。年越しは家の中でも暖かくしてお過ごしください。
政府 大雨警戒レベルを改定へ,市町村が住民に対して出す避難に関する情報のうち、大雨警戒レベル４の「避難勧告」と「避難指示」の２つの情報を「避難指示」に一本化するほか、レベル５の「災害発生情報」を「緊急安全確保」に変更することなどを盛り込んだ報告書を内閣府の作業部会がまとめました。　５段階の大雨警戒レベルのうち、「避難勧告」と「避難指示」は、どちらもレベル４に位置付けられているため、去年秋の台風１９号の際に「違いがわかりにくい」との声が住民や市町村から数多くあがったことなどから、有識者らで構成される内閣府の作業部会が見直しを検討してきました。 　その結果、レベル４は、「避難勧告」と「避難指示」を「避難指示」に一本化するほか、レベル５の「災害発生情報」についても、情報の名前からは住民がとるべき行動がわかりにくいうえ、市町村が災害の発生を把握できず、発令できないケースが多くみられたことから、「緊急安全確保」に変更することなどを盛り込んだ報告書をまとめました。内閣府は「警戒レベル４は、安全に避難ができる最後のタイミングなので、レベル５を待つことなく、レベル４のうちに避難を完了してほしい」と話しています。 　報告書には、レベル３の「避難準備・高齢者等避難開始」の「高齢者等避難」への名称変更も盛り込まれていますが、こうした変更には災害対策基本法の改正が必要で、内閣府は、来年の梅雨のシーズンに間に合うように準備を進める方針です。（24日19:24）
処理水の処分方法 決定は越年,東京電力福島第1原発のタンクにたまり続ける汚染処理水について、政府は24日、年内に処分方法を決定するのは厳しいとの見通しを明らかにした。当初は10月末に決定する方針だったが、漁業関係者らから反発を受け先送りしていた。　政府関係者によると、10月末以降も、海洋放出をした場合の風評被害の対策などを検討し、関係団体などと調整を続けている。しかし、決断できる段階には至っていないという。　さらに、経済産業省と東電はこれまで、汚染処理水をためるタンクの容量が満水になる時期を「22年夏」としていた。しかし、汚染処理水の増加量がこれまでの想定より減っていることなどから、政府はこの日、満水の見通しを「22年秋以降」と修正。これにより、処分方法の決定の時期は当初より余裕が生じることになった。　一方、東電は24日、福島第1原発で増え続ける汚染処理水のうち、国の放出基準を超える放射性物質が残る水を多核種除去設備「ALPS（アルプス）」を使って濃度を下げる再処理試験の結果を発表した。技術的に取り除けないトリチウム以外では、ゼロにはできなかったが国の基準を下回るまで濃度が下がった。　敷地内にたまり続けている汚染処理水には、トリチウム以外にも63種類の放射性物質が含まれ、11月の時点で容量は123万立方メートル余り（東京ドーム1個分に相当）に上る。うち、約7割は放射性物質の濃度が国の放出基準を超えている。アルプスのトラブルが続いたり、稼働率の向上を優先してフィルターの交換頻度を減らしたりしたためだ。　こうした状況を受け、海や大気中に放出するには、国の基準を下回るまでアルプスを使って濃度を下げなければならなくなった。東電は9月からアルプスによる再処理試験をして、濃度を検査していた。　その結果、ストロンチウム90など汚染処理水に含まれる放射性物質の中で大半を占める7種類の合計では、濃度が基準の2165倍だったが、6分の1以下に下がった。63種類全体で見ても、濃度が基準の約2400倍だったが3分の1近くになった。　セシウム134など51種類は、測定器で検出できる限界未満にまで取り除けた。ただ、ヨウ素129は国の基準を下回り26分の1程度にまで濃度が下がったものの、検出できる限界まで下がらなかった。【荒木涼子、塚本恒】
兵庫の開業医 3割が閉院検討,兵庫県保険医協会（神戸市中央区）が、会員の開業医らを対象に、自らの医療機関の将来に関する実態調査を行ったところ、回答者の約３割が「閉業」を予定していることが分かった。新型コロナウイルスの感染拡大による経営悪化の影響もあるとみられ、同協会は「地域医療の空白が懸念される」としている。（井川朋宏）　調査は７月６～１７日、開業医を中心とする同協会の会員から無作為に抽出した１１５７人を対象に実施。このうち３割超の４００人から回答を得た。　同協会によると、自らの医療機関の将来について、約半数が「不安がある」と答え、２年前の前回調査より５ポイント程度高くなった。また、開業医全般の将来展望についても「暗い」とした人が半数弱を占め、前回よりも約１０ポイント上昇した。　今回の調査では、新たに診療所の今後の継承について質問。回答者の約３割にあたる１２４人が閉業する予定だと答えた。親族への継承は約３割、親族以外への継承は１割強、事業の売却も７％しかない。　閉業予定と答えた開業医らが多かったことについて、同協会は「新型コロナの影響による減収が大きなきっかけになった」とみている。地域別では、中播磨・西播磨がやや目立った。　西山裕康理事長は「人口密度の低い地域では小児科などが１、２カ所閉業するだけでも、地域医療への影響は重大ではないか。問題視している」と述べた。
島全体がクラスター 島民不安,「一歩も外に出られない」「みんなピリピリしている」。24日に島全体をクラスター（感染者集団）と認定された沖縄県伊平屋村。村内の小中学校は15日から臨時休校し、共同売店は時間短縮営業を始めるなど、日常生活に影響が及ぶ。小規模離島での感染拡大という事態に、村民は保育や介護など福祉サービスへの波及を不安視している。　村内では22日から県による集団検査が始まり、濃厚接触者に加え、公務員や医療、介護従事者らが優先的に受診した。村内唯一の医療機関である伊平屋診療所は午前中を濃厚接触者らコロナ対応に充て、一般患者は午後に診療している。伊礼幸雄村長によると、金城時正副村長に加え、村職員4人の感染が確認されたが、現時点で村の業務に大きな支障はない。　小中学校は「第1波」と「第2波」の際には休校しなかったが、今回は休校に踏み切った。村は「家族間感染もあり、校内での感染を防ぐため」と説明する。　村在住の西銘仁正さん（72）は「1200人の村で30人は普通じゃない」と指摘。「このままだとありとあらゆる所に影響が出る。例えば保育園が休園したら、親は仕事ができなくなる。みんなもっと危機感を持つべきだ」と懸念する。　村高齢者生活福祉センターとらず園の伊礼春樹所長（49）は、島で感染者が初確認された12日以来、毎日施設内を消毒している。デイサービスは一時休止中。「厳戒態勢だが、サービスを受けないことで高齢者の心身機能が低下しかねない」と危惧。「離島の介護職は常に人手不足。僕らが感染した場合、代わりがいないことも不安だ」　村我喜屋区の山内進区長（70）は自宅で家族と会話する際もマスクを着け、役場との連絡も電話で済ませる。「今のところ高齢者の感染は少ないが、いつどうなるかは分からない。年をまたぐ2週間が勝負だ」と気を引き締めた。　■スナックから拡大か　伊平屋村内で最初に陽性者が出たのは今月12日。カラオケスナックの関係者で、家族によると、11月末から体調不良で自宅療養していた。島外から来店した客の1人が陽性になり、濃厚接触者としてPCR検査を受けたところ、陽性だった。　島内では12月6日、100人程度が参加した集落の忘年会があった。参加者によると、2次会に流れてこのスナックを利用した人たちがいて、その中の1人も後日、陽性が判明した。　同店では6日、本島からダンサーを招いた催しがあり、若者を中心に約20人の来店客がいた。9日に忘年会で同店を利用した金城時正副村長の陽性も判明していて、店の利用者を中心に感染が広がったとみられる。　村では現在、岸壁の整備や災害復旧などの工事が行われていて、島外から工事関係者が多数出入りしている。　5日には、村や村教委の主催で島外から出演者約30人を招いた芸能公演があり、同じ会場で会食も開かれた。出演者によると、村側の出演者の1人が陽性になったが、島外からの出演者に陽性者は確認されていないという。
東京五輪 組織委内にも悲観論,１年延期になった東京五輪・パラリンピック開催に向け、政府、東京都、組織委員会は、追加予算や新型コロナウイルス対策などを発表しているが、組織委の複数の理事らが、開催へ慎重論を訴えていることが２４日、分かった。この理事らは世界中での新型コロナ感染拡大の状況を踏まえ、「五輪を開くには状況が悪すぎる。不安と心配の方が大きく、国民の賛同が得られない」と厳しい見方を示した。　コロナ禍でも来夏の五輪開催準備が進む中、組織委内から慎重な意見が出てきた。ある理事は「このままでは五輪の最も大事なフェアプレーの精神を無視する形になってしまう」と指摘。コロナ禍で選手が練習できる国と、全くできない国の差が開いていることを危惧した。「選手がいくら努力しようとしても何もできない国もある。練習環境格差が生じてしまう。アンフェアーだ」と問題提起した。　国際オリンピック委員会（ＩＯＣ）によると、まだ五輪出場枠の４３％が固まっていない。レスリング、ボクシング、体操、ハンドボールなど来春以降に五輪予選会が予定されているが、コロナが収束するかは不透明で、開催できるかも見通せない。別の理事も、３度の延期の末、中止が決まった来年２月の卓球世界選手権団体戦（韓国・釜山）を例に挙げ、「各競技の予選会も簡単にはできそうにないし、代表に決まっていても実戦を重ねられない状況だと、五輪でベストパフォーマンスは見せられない」と心配する。　英国では感染力が高い新型コロナの変異種が広がっているとして、首都ロンドンなどで外出制限を導入した。感染が拡大している国など世界中から日本に来る観客にどう対応できるか、不安視する関係者もいる。「選手は競技が終了したらすぐに帰国することになるようだが、観客は五輪だけ見に来て終わりではないだろう。京都や北海道など観光地にも行く。マスクの強制もできないことを考えたら、迎える国民も対策を取るのは難しいのではないか」と話した。　東京五輪について、国内では「中止」「延期」への意見が強い。ある理事は「選手のことを考えると（大会を）開いてほしいが、コロナ対策をこうすることで開催できるという説得力ある話がないから、国民の賛同が少ないと思う。日本も連日感染者が増えるばかりで抑える施策が見えてこない。このままでは中止にせざるを得ない状況になってもおかしくない」と最悪の事態も口にした。　◆東京五輪の開催を巡る経過　▽３月２４日　安倍晋三首相（当時）と国際オリンピック委員会（ＩＯＣ）のトーマス・バッハ会長が電話形式の会談を行い、１年程度の延期で合意。　▽同３０日　来年７月２３日開幕の新たな日程を発表。バッハ会長は「難題を乗り越えられると確信している。東京五輪は（コロナ禍という）トンネルの出口を照らす光となる」とコメント。　▽８月２８日　安倍首相が退任を表明。会見で五輪への影響を問われ「しっかりと準備を進め、開催国としての責任を果たさなければならないと思う。次のリーダーも当然、その考え方のもとに目指していくんだろうと思う」と語った。　▽９月２３日　菅義偉新首相がバッハ会長と約１５分間の電話会談。同席した橋本聖子五輪相は「大会の開催と成功に向けての話し合いだった」と明かした。　▽１１月１１日　バッハ会長が会見で「中止の議論はない」と断言。１５日に延期決定後初めて来日した。　▽同２４日　ＩＯＣが五輪出場を目指す選手に向けバッハ会長のメッセージ動画を公開。「五輪へ準備し、非常に困難な状況下でもさらにハードな練習をしてください」と呼び掛けた。
剛力彩芽 一応「社長」です,＊　＊　＊　私、晴れ女なんです（笑い）。天気予報は曇りのち雨だったのに、太陽が顔を出してくれました。グラビアロケは４年ぶりだったけど、大人になった姿を自然に出せたかな。グラビアはカメラマンさんとの対話、ドラマは相手の役者さんとのお芝居だけど、作品を見てくれる人に伝えたいという気持ちは一緒です。　でも、お客さんが一方向から「引きの絵」しか見られない舞台は伝え方が大きく違う。出演中の『No.9 -不滅の旋律-』でも、広い舞台でお客さんに感情をどう伝えるか、難しいけど楽しんでやっています。　2020年夏に独立して会社を設立し、肩書きは一応「社長」です（笑い）。自分で把握しなきゃいけないことが増えて頭がこんがらがっちゃうけど、仕事の現場に親の付き添いがなくなった15歳の頃の初心を思い出しました。　昔は27歳までに結婚して子どもをほしいと思っていたけど、28歳になってみると、大切な人と過ごす時間を充実させるよりも、芸能の仕事を充実させたいと思うようになりました。私自身も、周りの人もワクワクしてもらえる30代を目指します！【プロフィール】剛力彩芽（ごうりき・あやめ）／1992年8月27日生まれ、神奈川県出身。2008年から『Seventeen』専属モデルとして活動を開始し、2011年のドラマ『大切なことはすべて君が教えてくれた』で本格的に女優デビュー。その後、ドラマや映画を中心に活躍。2020年8月末に前所属事務所を退社し、個人事務所「株式会社ショートカット」を設立。2021年1月7日まで舞台『No.9－不滅の旋律－』（東京・TBS赤坂ACTシアター）でベートーヴェンを秘書として支えるマリア・シュタイン役を演じる。■撮影／丸谷嘉長※週刊ポスト2021年1月1・8日号